<?xml version="1.0" encoding="utf-8"?>
<xs:schema id="scriptConfig" targetNamespace="http://www.hzfh.com/web" xmlns="http://www.hzfh.com/web" xmlns:xs="http://www.w3.org/2001/XMLSchema" xmlns:msdata="urn:schemas-microsoft-com:xml-msdata" attributeFormDefault="qualified" elementFormDefault="qualified">
  <xs:element name="scriptConfig" msdata:IsDataSet="true" msdata:Locale="en-US">
    <xs:complexType>
      <xs:choice minOccurs="0" maxOccurs="unbounded">
        <xs:element name="scriptMappings">
          <xs:complexType>
            <xs:sequence>
              <xs:element name="script" nillable="true" minOccurs="0" maxOccurs="unbounded">
                <xs:complexType>
                  <xs:simpleContent msdata:ColumnName="add_Text" msdata:Ordinal="7">
                    <xs:extension base="xs:string">
                      <xs:attribute name="name" form="unqualified" type="xs:string" />
                      <xs:attribute name="order" form="unqualified" type="xs:string" />
                      <xs:attribute name="type" form="unqualified" type="xs:string" />
                      <xs:attribute name="dynamic" form="unqualified" type="xs:string" />
                      <xs:attribute name="enabled" form="unqualified" type="xs:string" />
                      <xs:attribute name="displayOnlyOnProduction" form="unqualified" type="xs:string" />
                      <xs:attribute name="pageZone" form="unqualified" type="xs:string" />
                      <xs:attribute name="isDevelop" form="unqualified" type="xs:string" />
                      <xs:attribute name="limitBrowserType" form="unqualified" type="xs:string" />
                      <xs:attribute name="limitBrowserVersion" form="unqualified" type="xs:string" />
                    </xs:extension>
                  </xs:simpleContent>
                </xs:complexType>
              </xs:element>
            </xs:sequence>
          </xs:complexType>
        </xs:element>
        <xs:element name="sharedScriptGroups">
          <xs:complexType>
            <xs:sequence>
              <xs:element name="scriptGroup" minOccurs="0" maxOccurs="unbounded">
                <xs:complexType>
                  <xs:sequence>
                    <xs:element name="scriptName" nillable="true" minOccurs="0" maxOccurs="unbounded">
                      <xs:complexType>
                        <xs:simpleContent msdata:ColumnName="scriptName_Text" msdata:Ordinal="0">
                          <xs:extension base="xs:string">
                          </xs:extension>
                        </xs:simpleContent>
                      </xs:complexType>
                    </xs:element>
                  </xs:sequence>
                  <xs:attribute name="name" form="unqualified" type="xs:string" />
                </xs:complexType>
              </xs:element>
            </xs:sequence>
            <xs:attribute name="default" form="unqualified" type="xs:string" />
          </xs:complexType>
        </xs:element>
        <xs:element name="privateScriptGroups">
          <xs:complexType>
            <xs:sequence>
              <xs:element name="scriptGroup" minOccurs="0" maxOccurs="unbounded">
                <xs:complexType>
                  <xs:sequence>
                    <xs:element name="scriptName" nillable="true" minOccurs="0" maxOccurs="unbounded">
                      <xs:complexType>
                        <xs:simpleContent msdata:ColumnName="scriptName_Text" msdata:Ordinal="0">
                          <xs:extension base="xs:string">
                          </xs:extension>
                        </xs:simpleContent>
                      </xs:complexType>
                    </xs:element>
                    <xs:element name="pages" minOccurs="0" maxOccurs="unbounded">
                      <xs:complexType>
                        <xs:sequence>
                          <xs:element name="pageName" nillable="true" minOccurs="0" maxOccurs="unbounded">
                            <xs:complexType>
                              <xs:simpleContent msdata:ColumnName="pageName_Text" msdata:Ordinal="0">
                                <xs:extension base="xs:string">
                                </xs:extension>
                              </xs:simpleContent>
                            </xs:complexType>
                          </xs:element>
                        </xs:sequence>
                      </xs:complexType>
                    </xs:element>
                  </xs:sequence>
                  <xs:attribute name="name" form="unqualified" type="xs:string" />
                  <xs:attribute name="sharedScriptGroup" form="unqualified" type="xs:string" />
                </xs:complexType>
              </xs:element>
            </xs:sequence>
          </xs:complexType>
        </xs:element>
      </xs:choice>
    </xs:complexType>
  </xs:element>
</xs:schema>