<?xml version="1.0"?>
<scriptConfig xmlns="http://www.hzfh.com/web"
              xmlns:xsi="http://www.w3.org/2001/XMLSchema-instance"
              xsi:schemaLocation="http://www.hzfh.com/web ../../Schemas/Resources/Script.xsd">

    <sharedScriptGroups default="Common">

        <scriptGroup name="Common">
            <scriptName>jQuery</scriptName>
            <scriptName>common</scriptName>
            <scriptName>environmentVariable</scriptName>
            <scriptName>base</scriptName>
        </scriptGroup>
        <scriptGroup name="Empty"></scriptGroup>
    </sharedScriptGroups>
</scriptConfig>
